{
  "version": 1,
  "factory_repo": "BicameralAI/bicameral-factory",
  "factory_commit": "603128681ba145274479889d2f7d6a0bdd5c1fdb",
  "loaded_context": [
    "README.md", "CONTRIBUTING.md", "playbooks/devin-bicameral-factory-run.md",
    "blueprints/factory-attestation.md", "blueprints/factory-run-signals/artifact-boundary.md",
    "blueprints/factory-run-signals/domain-entity-candidates.md", "blueprints/factory-run-signals/factory-learning-signals.md",
    "blueprints/factory-run-signals/minimum-product-validation.md", "skills/bic/to-runtime-spec/SKILL.md",
    "blueprints/runtime-architecture-spec.md", "skills/bic/to-spec/SKILL.md",
    "skills/bic/spec-governance-gate/SKILL.md", "skills/bic/pre-pr-factory-attestation/SKILL.md",
    "docs/governance/user-journeys.md", "knowledge/product-validation-roadmap.md"
  ],
  "local_setup_divergence": {"checked": true, "resolution": "not_applicable", "notes": "The isolated clone used proposed factory PR #277 at its exact head. The Product PR remains draft and blocked on #277."},
  "roadmap_reconciliation": {"checked": true, "issue_number": 65, "issue_type": "validated", "project_status": "In Progress", "pr_links_checked": true, "pr_body_links_issue": true, "pr_links": [], "post_work_comment_url": null, "notes": "Documentation seed for cross-repo runtime contract alignment."},
  "state_refinement": {"checked": true, "release_state": "No lifecycle behavior changed.", "states_added": [], "states_deferred": [], "invariants": ["No canonical state, authority, or persistence semantics changed.", "Integrations remain evidence adapters, not state authorities."], "minimization_review": {"reviewed": true, "rejected_or_collapsed_states": [], "rationale": "Docs-only conformance baseline; no connector lifecycle state added."}},
  "end_of_session_capture": {"run": true, "factory_pr": "https://github.com/BicameralAI/bicameral-factory/pull/277", "notes": "Conformance rows record the durable cursor-owner gap as planned evidence rather than inventing a persistence path."},
  "attested_by": "Codex (manual collaborator factory run)",
  "timestamp": "2026-07-17T11:00:00Z",
  "target_repo": "BicameralAI/bicameral-integrations",
  "target_branch": "agent/seed-runtime-conformance"
}
